nevertheless, people are eating  a lot of meat and the meat industry is thriving.	The meat industry is important/thriving
our meat industry is thriving.	The meat industry is important/thriving
some countries culture are heavily influenced by the consumption of meat	The meat industry is important/thriving
the economy behind meat production is booming.	The meat industry is important/thriving
the economy is doing quite well in this sector.	The meat industry is important/thriving
the industry as a whole is thriving.	The meat industry is important/thriving
the industry is thriving.	The meat industry is important/thriving
the meat business is thriving	The meat industry is important/thriving
the meat house industry continues to thrive.	The meat industry is important/thriving
the meat industry continues to thrive as more and more meat is consumed.	The meat industry is important/thriving
the meat industry continues to thrive.	The meat industry is important/thriving
the meat industry is doing an all time high amount of business.	The meat industry is important/thriving
the meat industry is still striving	The meat industry is important/thriving
the meat industry is thriving	The meat industry is important/thriving
the meat industry is thriving right now.	The meat industry is important/thriving
the meat industry is thriving.	The meat industry is important/thriving
the meat industry is thriving.	The meat industry is important/thriving
