recent research shows that feeding cows seaweed reduces the amount of methane cow burps release.	Feedback_13
research has shown if cows consume seaweed they release up to 99% less methane in their burps.	Feedback_13
research has shown that cows who consume seaweed as part of their diets, they release up to 99% less methane in their burps.	Feedback_13
research has shown that when cows consume seaweed as part of their diets, they release up to 99% less methane gas.	Feedback_13
research has shown that when cows consume seaweed as part of their diets, they release up to 99% less methane in their burp.	Feedback_13
research has shown that when cows consume seaweed as part of their diets, they release up to 99% less methane in their burps.	Feedback_13
research shows if they consume seaweed in their diet the greenhouse gases they emit will reduce by one third.	Feedback_13
research shows that a possible diet change could decrease the methane in cow burps.	Feedback_13
research shows that if cows consume seaweed as part of their diet, the release 99% methane in their burps	Feedback_13
researchers believe eating less meat will help.	Feedback_13
researchers have found a solution to incorporate seaweed into the cows diet to minimize the burps.	Feedback_13
researches say that changing our diet to vegetable based meats would reduce emissions greatly.	Feedback_13
if cows consume seaweed as part of their diets, they release up to 99% less methane in their burps.	Feedback_13
if cows consume seaweed they release 99% less methane in their burps	Feedback_13
if cows consume seaweed those emissions would go down to almost zero.	Feedback_13
if cows consume seaweed, it will decrease the methane in their burps by 99%.	Feedback_13
if cows consumed seaweeds as part of their daily diets the problems would be diminished.	Feedback_13
if cows eat seaweed as part of their diet, they release less methane gas when they burp.	Feedback_13
If cows eat seaweed this can be reduced by 99%.	Feedback_13
if cows eat seaweed, they produce less methane.	Feedback_13
if farmers fed cows a seaweed rich diet, they can reduce methane gas emissions by 99 percent.	Feedback_13
if Farmers start feeding seaweed to their cows it'll help cut back 99% of the methane or from cow burps.	Feedback_13
if farmers were to feed their cows seaweed, the amount of methane they release may almost entirely be eradicated.	Feedback_13
if farmers were willing to add seaweed to their cows feed, they could drastically reduce greenhouse gases.	Feedback_13
if fed seaweed as part of their diet reduces the methane in their burps.	Feedback_13
if fed seaweed in their diet cow burps contain 99 percent less methane.	Feedback_13
if people switch to plant based meat alternatives the problem will decrease.	Feedback_13
if the cow eats seaweed, the cow burps methane content is reduced by 99%	Feedback_13
if the cows consume seaweed, they produce less methane.	Feedback_13
if the cows diet is changes, there could be a reduction of has up to 99 percent if fed algae	Feedback_13
if they ate seaweed more often, they would burp less.	Feedback_13
if they consume seaweed they will release 99% less methane.	Feedback_13
if they eat a seaweed based diet, they release 99% less methane in their burps.	Feedback_13
if they eat more seaweed this harmful amounts could be decreased significantly.	Feedback_13
if they eat seaweed as part of their diet, it lowers the methane they produce by 99%.	Feedback_13
if they eat seaweed it is 99% less gases released.	Feedback_13
if they eat seaweed they can reduce their burp methane by 99%.	Feedback_13
if they eat seaweed they emit 99% less methane.	Feedback_13
if we create plant based meat it would counter act that problem.	Feedback_13
if we remove seaweed from cows diets we could reduce the amount of methane from cow burps by 99%	Feedback_13
if we switch their feed from grass so seaweed their burp a lot less methane.	Feedback_13
if you had seaweed to their diet it could reduce 99 percent of methane.	Feedback_13
when cow's eat seaweed it produces 99 % less methane in there burp.	Feedback_13
when cows are fed seaweed they emit 99% less methane in their burps.	Feedback_13
when cows consume seaweed as part of their diets, they release up to 99% less methane	Feedback_13
when cows consume seaweed as part of their diets, they release up to 99% less methane in their belching	Feedback_13
when cows consume seaweed as part of their diets, they release up to 99% less methane in their burps.	Feedback_13
when cows consume seaweed they produce 99 percent less methane in there burps.	Feedback_13
when cows consume seaweed they release 99% less Methane.	Feedback_13
when cows consume seaweed, they release up to 99% less methane in their burps.	Feedback_13
when cows eat seaweed as part of their diet, the methane content in their burps decreases by 99%.	Feedback_13
when cows eat seaweed the methane they produce can be cut by 99%	Feedback_13
when cows eat seaweed they produce 99% less methane in their burps which could reduce one third of greenhouse gases emitted by animal agriculture.	Feedback_13
when cows eat seaweed, they release up to 99% less methane in their burps.	Feedback_13
when fed a diet including seaweed, cows release up to 99% less methane in their burps.	Feedback_13
when fed seaweed as part of their diets, they release up to 99% less methane in their burps.	Feedback_13
when fed seaweed, cows produce 99% less methane.	Feedback_13
when fed seaweed, cows release 99% less methane in their burps.	Feedback_13
when feed partially with a seaweed diet, methane emissions can reduce up to 99%	Feedback_13
when given seaweed as part of their diets, they release up to 99% less methane in their burps.	Feedback_13
when they consume seaweed as part of their diet, their burps contain 99% less methane.	Feedback_13
when they consume seaweed they produce less methane.	Feedback_13
when they eat seaweed, they burp 99% less methane	Feedback_13
a change in their diet to include seaweed could reduce the methane they produce by 99%.	Feedback_13
a diet of seaweed can cut the methane gas down by 1/3.	Feedback_13
a diet with seaweed would reduce the methane.	Feedback_13
because they eat seaweed they release less than 99% less methane.	Feedback_13
by changing their diet to seaweed it reduces cattle methane by 99% and animal agricultural methane production by 33%.	Feedback_13
by consuming seaweed, rather than grains, it can reduce the amount of methane generated by up to 99%.	Feedback_13
by eating seaweed, cows may burp less methane.	Feedback_13
by having cows eat seaweed it has been said that they emit 99% less methane in their burps.	Feedback_13
by having cows eat seaweed, less methane will be released.	Feedback_13
can be changed by feeding the cows seaweed.	Feedback_13
can be fixed by feeding the cows seaweed.	Feedback_13
can be lessened by feeding cows seaweed instead.	Feedback_13
can be mitigateed by feeding them seaweed which will cut greenhose from animal farming by 1/3.	Feedback_13
can reduced my 99% if fed a seaweed diet.	Feedback_13
could be decreased by supplementing the cow's diet with seaweed.	Feedback_13
could be lessened if cows consumed seaweed in their diets.	Feedback_13
cow burps could be made less harmful if cows are fed a different diet such as seaweed.	Feedback_13
cow burps release up to 99% less methane when cows are fed seaweed as part of their diets.	Feedback_13
cows can change their diets to seaweed and release 99% less methane in their burps.	Feedback_13
cows can consume seaweed as part of their diets because less methane is released in their burps.	Feedback_13
cows can consume seaweed to change the release of methane	Feedback_13
cows consume seaweed as part of their diets, they release up to 99% less methane in their burps.	Feedback_13
cows could produce less methane if they eat seaweed instead of grass.	Feedback_13
cows fed seaweed produce 99% less methane in their burps.	Feedback_13
cows that are fed seaweed harms the environment less, by 99%.	Feedback_13
cows that consume seaweed produce 99% less methane.	Feedback_13
cows that eat seaweed burp less methane.	Feedback_13
cows that eat seaweed put out less methane.	Feedback_13
cows that have a diet that includes seaweed can reduce their methane output by up to 99%.	Feedback_13
cows who are fed seaweed as part of their diet do not release as much methane in their burps.	Feedback_13
eating seaweed as part of their diets releases 99% less methane in their burps which reduced greenhouse gas emission by one third.	Feedback_13
eating seaweed as part of their diets, they will release up to 99% less methane in their burps.	Feedback_13
farmers can feed their cows seaweed to reduce the amount of Methane cows burp;	Feedback_13
farmers say that if cows eat seed containing seaweed, their methane production is reduced by 99 percent.	Feedback_13
feeding seaweed to cows in addition to their regular food can reduce their production of methane by up to 99%.	Feedback_13
feeding seaweed to cows reduces the amount of methane they burp.	Feedback_13
having a seaweed diet can prevent the cow's burps from containing much less methane.	Feedback_13
it can be controlled using seaweed in their diet.	Feedback_13
it can be cut down by farmers adding seaweed to the cows diet.	Feedback_13
it can be significantly reduced by fees other seaweed.	Feedback_13
it could be lessened if cow's ate seaweed.	Feedback_13
it is lessened when they consume seaweed.	Feedback_13
it is possible to mitigate or eliminate expelled methane by adding seaweed to a bovine diet.	Feedback_13
it only accounts for 14.5% of the world's greenhouse gases, and we could reduce this by adding seaweed to what we feed cows.	Feedback_13
it's possible to switch feeds to seaweed which produces significantly less methane.	Feedback_13
less methane is released when cows eat other foods like seaweed.	Feedback_13
many people say feeding them seaweed could lower the emissions.	Feedback_13
modifying their diets such as adding seaweed lessens the amount of methane burped.	Feedback_13
scientists and farmers pose that incorporating seaweed into cows' diet causes them to release 99% less methane in their burps.	Feedback_13
scientists have discovered a method, whereby adding seaweed to the cow's diet, will reduce the methane content of their burps by 99%.	Feedback_13
seaweed used as food does not release as much methane as traditional grass.	Feedback_13
some research suggests that adding seaweed to cows' diets will reduce the amount of released methane.	Feedback_13
studies are showing that changing diet in cattle such as including seaweed in the diet may reduce the methane gases by up to 99%.	Feedback_13
studies have shown that feeding cows seaweed can reduce the methane by 99%.	Feedback_13
studies show that cattle diet including seaweed results in 99% less methane being released so perhaps there are ways to combat this.	Feedback_13
that could be remedied by feeding cows seaweed, which would significantly reduce the amount of Methane they produce.	Feedback_13
the addition of seaweed to their diet reduses methane by 99 percent.	Feedback_13
the amount of methane produced by cow burps can be reduced by 99% by including seaweed as a part of the cow's diet.	Feedback_13
the amount of methane produced can be reduced significantly by adding seaweed to cows diets.	Feedback_13
the amount of methane released could be reduced by adding seaweed to cow's diets.	Feedback_13
the amount of methane released from cows can be reduced by adding seaweed to their diet.	Feedback_13
the amount of methane they burp can be reduced if they are given seaweed to eat.	Feedback_13
the amount of methane they release can be decreased when they are fed a diet of seaweed.	Feedback_13
the amount of methane they release into the environment can be reduced by changing the cows' diet to include seaweed.	Feedback_13
the amount they produce can be lowered by introducing seaweed into their diets.	Feedback_13
the burps can contain almost 90% less methane if there is seaweed mixed into their daily diets.	Feedback_13
the effect may be reduced by feeding cows a portion of seaweed in their diet which can reduce methane in their burps about 99%.	Feedback_13
the impact can be lessened by feeding cows seaweed.	Feedback_13
the problem can be mitigated by switching the food cows eat to seaweed, which causes cows to produce 99% lessmethsne	Feedback_13
the type of food a cow eats, such as seaweed, can drastically cut down on the release of that gas.	Feedback_13
their contribution to the greenhouse effect could be mediated by adding seaweed to their diets.	Feedback_13
their impact can be decreased by introducing seaweed into their diet.	Feedback_13
there are alternative food for cows, seaweed is one that will reduce methane 99%.	Feedback_13
there are alternatives, such as Impossible Meat (plant-based "meats" that have the taste and texture of the real thing) and changing the diets of cows to include seaweed; an abundant alternative that can reduce the amount of methane they	Feedback_13
there are foods to feed cows, such as seaweed, that can dramatically reduce the amount of methane found in cow burps.	Feedback_13
there are other things that can be done to decrease the amount of methane gas released by cows such as incorporating seaweed into feed.	Feedback_13
there are solutions, like Impossible burgers and them eating seaweed instead.	Feedback_13
there are some who believe that this can be alleviated by changing the food that cows consume such as feeding them seaweed which decreases the methane gas from cows burping by as much as 99%.	Feedback_13
there are ways to decrease the harm by feeding the cows seaweed.	Feedback_13
there are ways to farm that could eliminate some of that problem, like by feeding the cows seaweed.	Feedback_13
there are ways to possibly limit the gas if cows are fed seaweed as part of their diet.	Feedback_13
there can be a reduction in methane released by feeding cows seaweed in their diet instead of what they currently eat.	Feedback_13
there may be ways to decrease methane from cow burps, like feeding cows seaweed.	Feedback_13
they can be solved by feeding the cows seaweed which reduces the methane release by ninety nine percent.	Feedback_13
they can feed the cows seaweed and it will cut down the gases by 99%.	Feedback_13
they could be fed seaweed instead to decrease the release of methane.	Feedback_13
they could feed cows seaweed which released 99 percent less greenhouse gasses.	Feedback_13
they release up to 99% less methane in their burps when they consume seaweed as part of their diets.	Feedback_13
this can be fixed by feeding them a steady diet of seaweed.	Feedback_13
this could be mitigated by feeding them seaweed, which reduces methane by up to 99%.	Feedback_13
this problem can be diminished by including seaweed in their diet.	Feedback_13
we can lessen it by feeding them seaweed.	Feedback_13
we can lower that by turning to plant based alternatives or feeding cows seaweed based food.	Feedback_13
we can lower the amount of methane from feeding seaweed to cows.	Feedback_13
we can reduce their methane output by feeding them seaweed.	Feedback_13
we can substantially reduce the methane by supplementing part of their diet with seaweed.	Feedback_13
we could reduce that by feeding them seaweed.	Feedback_13
we may be able to reduce cow burps by feeding them seaweed, which research has shown reduces methane released from cow burps by 99%.	Feedback_13
you can feed cows seaweed to lessen the methane.	Feedback_13
some scientists think that instead not raising cows for food farmers could change what they feed their cattle so they do not burp as much.	Feedback_13
an alternative would be to change the cow's diet to reduce the methane that they burp out.	Feedback_13
by eating seawood the methane in their burps is reduced 99 percent.	Feedback_13
seeweed eliminates 99% of the methane.	Feedback_13
there is something to be done to reduce that effect, one is to change the cows diet by introducing seeweed, another would be to reduce the amount of meat consumption in order to help the environment.	Feedback_13
seaweed causes way less	Feedback_13
seaweed releases less methan.	Feedback_13
seaweed will reduce the amount of toxins to the atmosphere.	Feedback_13
we can reduce them with seaweed.	Feedback_13
we can change their diet to help eliminate the gas produces by the burps.	Feedback_13
could be less if we change their diet.	Feedback_13
if we changed what they eat the gas they emit could be reduced by 99 percent.	Feedback_13
cows that eat seaweed release up to 99% less gas.	Feedback_13
some scientists and farmers believe that adding seaweed to the cattle's diet will reduce methane emissions by one-third.	Feedback_13
studies find that the expelled gas can be controlled by feeding the cow's alternate food such as seaweed.	Feedback_13
you can reduce thing by feeding them seaweed	Feedback_13
it can be reduced by eating less meat.	Feedback_13
plant based meats are available and are great alternatives for many people; some others think feeding cows seaweed can help.	Feedback_13
seaweed, when fed to cows, has a lesser effect.	Feedback_13
