stopping this could hurt the economy taking away jobs.	Less meat consumption could harm economy and cut jobs
stopping this would cause great problem in the enconomy and loss of jobs.	Less meat consumption could harm economy and cut jobs
taking away jobs	Less meat consumption could harm economy and cut jobs
taking away the meat industry would be damaging to the economy and the job market.	Less meat consumption could harm economy and cut jobs
the industry is growing as more countries consume and transport meat, so reducing meat intake could hurt the economy.	Less meat consumption could harm economy and cut jobs
the loss of jobs from the livestock production sector which could result as a reduction/elimination of meat consumption, might result in a major economic crisis.	Less meat consumption could harm economy and cut jobs
the meat industry is doing very well and limiting consumption could very well hurt our economy.	Less meat consumption could harm economy and cut jobs
the meat industry is thriving and reducing meat consumption could damage domestic industry	Less meat consumption could harm economy and cut jobs
there is concern that reducing meat production could harm the economy.	Less meat consumption could harm economy and cut jobs
to cut out meat eating would harm the USA economy.	Less meat consumption could harm economy and cut jobs
we don't want to lose jobs.	Less meat consumption could harm economy and cut jobs
without it many people will lose their jobs creating a poor economy that just trickles down to the rest of the population, ie. stores closing (people not having the money to buy anything but essentials, job loss, etc.	Less meat consumption could harm economy and cut jobs
also providing a lot of jobs and helping the economy.	Meat creates jobs and benefits economy
America's economy is sustained because of meat exports.	Meat creates jobs and benefits economy
are a source of employment and revenue domestically.	Meat creates jobs and benefits economy
are also beneficial to the economy because of the many jobs associated with meat production and transportation.	Meat creates jobs and benefits economy
are an important domestic industry, helping maintain a strong economy.	Meat creates jobs and benefits economy
are helping the economy.	Meat creates jobs and benefits economy
are important part of the economy.	Meat creates jobs and benefits economy
are supporting the economy, especially as the world incorporates more meat in their diets.	Meat creates jobs and benefits economy
at the same time meat industry is a thriving industry that boost economy by providing job opportunities	Meat creates jobs and benefits economy
benefiting the economy.	Meat creates jobs and benefits economy
caring and raising the livestock produces jobs.	Meat creates jobs and benefits economy
does create jobs and has the meat industry thriving.	Meat creates jobs and benefits economy
exported meat is making a lot of profit.	Meat creates jobs and benefits economy
exports of meat help the economy.	Meat creates jobs and benefits economy
giving many people jobs!	Meat creates jobs and benefits economy
helping keep alot of domestic jobs.	Meat creates jobs and benefits economy
helping the economy as more and more countries adopt meat eating.	Meat creates jobs and benefits economy
helps the economy by creating lucrative jobs.	Meat creates jobs and benefits economy
is also giving people jobs and helping the economy.	Meat creates jobs and benefits economy
is an important domestic industry that gives many jobs and helps the economy thrive.	Meat creates jobs and benefits economy
is an important part of domestic economy.	Meat creates jobs and benefits economy
is good for the economy.	Meat creates jobs and benefits economy
it also helps the economy through importing meat to different countries.	Meat creates jobs and benefits economy
it benefit domestic industry, economy and precious jobs	Meat creates jobs and benefits economy
it creates jobs	Meat creates jobs and benefits economy
it creates jobs and is good for the economy.	Meat creates jobs and benefits economy
it creates many jobs and money.	Meat creates jobs and benefits economy
it helps to create jobs.	Meat creates jobs and benefits economy
it is a large part of tge American economy.	Meat creates jobs and benefits economy
it is also boosting the economy and providing many jobs.	Meat creates jobs and benefits economy
it is also creating and maintaining jobs and supporting the economy.	Meat creates jobs and benefits economy
it is also driving the economy.	Meat creates jobs and benefits economy
it is also good for the economy.	Meat creates jobs and benefits economy
it is also helping the economics of the world due to more people consuming meat world wide.	Meat creates jobs and benefits economy
it is also helping the economy due to increasing exports to an increasing number of other countries.	Meat creates jobs and benefits economy
it is also part of American industry and economy which means that it helps support jobs	Meat creates jobs and benefits economy
it is also providing a ton of jobs in the domestic industry.	Meat creates jobs and benefits economy
it is also very beneficial for the economy and it creates a lot of jobs by producing and exporting meat.	Meat creates jobs and benefits economy
it is an important domestic industry and provides jobs.	Meat creates jobs and benefits economy
it is an important part of the economy	Meat creates jobs and benefits economy
it is contributing to jobs in America and apart of our culture.	Meat creates jobs and benefits economy
it is creating jobs.	Meat creates jobs and benefits economy
it is helping Americans knowing that there is an industry for meat consumption.	Meat creates jobs and benefits economy
it is helping the economy by providing more jobs and exporting it to other countries that are starting to add meat into their daily diets.	Meat creates jobs and benefits economy
it is helping the economy.	Meat creates jobs and benefits economy
it provides a lot of jobs for people.	Meat creates jobs and benefits economy
it provides many jobs and is ingrained in our culture.	Meat creates jobs and benefits economy
it provides many jobs.	Meat creates jobs and benefits economy
its good for our domestic economy.	Meat creates jobs and benefits economy
many jobs are provided by the meat industry.	Meat creates jobs and benefits economy
meat consumption has created an industry where it plays a role in the economy and jobs creation.	Meat creates jobs and benefits economy
meat exports are occurring which stabilize and provide jobs for Americans.	Meat creates jobs and benefits economy
meat is also important for our economy because it represents a large part of exports and domestic trade.	Meat creates jobs and benefits economy
meat produced domestically can be exported and help the economy.	Meat creates jobs and benefits economy
meat production is a significant part of the U.S. economy.	Meat creates jobs and benefits economy
meat production is an integral part of the American economy and also exports are increasing.	Meat creates jobs and benefits economy
raising, transporting, selling and exporting meat are major industries important to the economy of the nation.	Meat creates jobs and benefits economy
since other countries are starting to incorporate more meat into their diets, the meat industry is thriving and helping the American economy.	Meat creates jobs and benefits economy
that industry creates many jobs.	Meat creates jobs and benefits economy
the domestic industry thrives from it.	Meat creates jobs and benefits economy
the economy also benefits from the jobs created and revenue provided through raising livestock for food.	Meat creates jobs and benefits economy
the economy is strengthened by the consumption of meat.	Meat creates jobs and benefits economy
the industry is a large part of the American economy.	Meat creates jobs and benefits economy
the industry is an important portion of the economy, producing many jobs	Meat creates jobs and benefits economy
the industry is booming and is a vital part of the economy.	Meat creates jobs and benefits economy
the industry provides many jobs.	Meat creates jobs and benefits economy
the Meat creates jobs and benefits in the economy for people.	Meat creates jobs and benefits economy
the meat industry accounts for a large portion of jobs in the US.	Meat creates jobs and benefits economy
the meat industry also created many jobs domestically.	Meat creates jobs and benefits economy
the meat industry also creates good jobs.	Meat creates jobs and benefits economy
the meat industry also creates precious jobs as more meat is exported, boosting the economy.	Meat creates jobs and benefits economy
the meat industry also provides jobs and helps the local economy.	Meat creates jobs and benefits economy
the meat industry also provides valuable jobs and supports the economy.	Meat creates jobs and benefits economy
the meat industry creates a lot of jobs for Americans.	Meat creates jobs and benefits economy
the meat industry creates many jobs and contributes to a healthy economy	Meat creates jobs and benefits economy
the meat industry helps the economy and provides jobs for people.	Meat creates jobs and benefits economy
the meat industry is a major provider of jobs for the economy.	Meat creates jobs and benefits economy
the meat industry is a thriving staple for the U.S. economy.	Meat creates jobs and benefits economy
the meat industry is also an important source of American jobs.	Meat creates jobs and benefits economy
the meat industry is booming in America, and creating great economic growth.	Meat creates jobs and benefits economy
the meat industry is crucial to the world's economy.	Meat creates jobs and benefits economy
the meat industry is important and accounts for a large amount of jobs.	Meat creates jobs and benefits economy
the meat industry is important economically, and some believe that responsible meat consumption is acceptable as a small part of a mostly plant-based diet.	Meat creates jobs and benefits economy
the meat industry is thriving and allowing growth of the domestic industry and more importantly domestic jobs to support our own economy.	Meat creates jobs and benefits economy
the meat industry is thriving and provides lots of jobs.	Meat creates jobs and benefits economy
the meat industry is thriving and provides many jobs.	Meat creates jobs and benefits economy
the meat industry is thriving and providing jobs for a number of Americans each year.	Meat creates jobs and benefits economy
the meat industry is thriving because beef produced domestically is a huge export and is helping the economy.	Meat creates jobs and benefits economy
the meat industry provides jobs	Meat creates jobs and benefits economy
the meat industry provides jobs and economic benefits.	Meat creates jobs and benefits economy
the meat industry provides jobs for Americans.	Meat creates jobs and benefits economy
the meat industry provides jobs for many people.	Meat creates jobs and benefits economy
the meat industry provides jobs.	Meat creates jobs and benefits economy
the meat industry provides many jobs important to the American economy.	Meat creates jobs and benefits economy
the meat industry provides many jobs.	Meat creates jobs and benefits economy
the meat industry provides many jobs.	Meat creates jobs and benefits economy
the meat industry supports many many precious jobs.	Meat creates jobs and benefits economy
the meat industry supports the economy and workers.	Meat creates jobs and benefits economy
the rise in meat consumption has created important jobs and contributed to improvements in the economy.	Meat creates jobs and benefits economy
they are a part of our culture and they employ a lot of people.	Meat creates jobs and benefits economy
they are benefiting the global economy.	Meat creates jobs and benefits economy
they are helping the economy stay strong and vibrant.	Meat creates jobs and benefits economy
they are part of American tradition, and also create jobs.	Meat creates jobs and benefits economy
they are vital to the domestic economy.	Meat creates jobs and benefits economy
they create  and contribute to the over all domestic industry and economy.	Meat creates jobs and benefits economy
they help domestic industries and create jobs.	Meat creates jobs and benefits economy
we are making money off the exporting of meat to other countries.	Meat creates jobs and benefits economy
we need it for jobs.	Meat creates jobs and benefits economy
we ship a lot of meats to other countries for consumption, so we're profitable.	Meat creates jobs and benefits economy
will maintain the economy.	Meat creates jobs and benefits economy
cars, trucks, trains, and airplanes produce more green house gases.	Outside of article's scope
cattle farmers and others do not believe that to be true.	Outside of article's scope
claims of how much damage is being done are exaggerated because climate change is a natural part of how the changes over time.	Outside of article's scope
eating meat occasionally doesn't hurt our health.	Outside of article's scope
eating meat will provide nutrients, which support muscle and brain function in the body.	Outside of article's scope
eating small amounts could be beneficial to our health.	Outside of article's scope
God gave us meat to eat after the flood as part of our nutritional needs	Outside of article's scope
human body is health	Outside of article's scope
it adds to the protein needed for good nutrition.	Outside of article's scope
it doesnt show.	Outside of article's scope
it may mess the enviormen up if stopped all at once.	Outside of article's scope
it was really not bad	Outside of article's scope
its being destroyed by practically everything now so I wouldnt be too concerned.	Outside of article's scope
its not the only thing harming the environment the pollution by cars, trucks, trains, and airplanes cause it also	Outside of article's scope
large, concentrated crop farms also use lots of water and harm the environment.	Outside of article's scope
meat raised the way to was meant to be is heathy	Outside of article's scope
most of the beef produced domestically is eaten by Americans.	Outside of article's scope
not as much as alarmist wants you to think.	Outside of article's scope
only amount to 1/5 of the total greenhouse gas creation of humans; we need to investigate the other 4/5 further.	Outside of article's scope
our water supply is in reality adequate to raise livestock so that we can eat meat.	Outside of article's scope
people are trying to live a healthier life by being vegan.	Outside of article's scope
small farms can save the environment	Outside of article's scope
the meat is more likely food for many  peoples	Outside of article's scope
the population's need is too great to be ignored.	Outside of article's scope
their is nothing to worry about because industry adapts to demand, Avocado orchids, mushroom farms, and veganic farming are on the up and up.	Outside of article's scope
there are safer options.	Outside of article's scope
we still dont care about the environment.	Outside of article's scope
what harm is actually being done.	Outside of article's scope
you can counteract this by changing other actions like driving less and buying fewer goods.	Outside of article's scope
Americans are unlikely to change their habits due to the integration of meat into American culture.	People will or should still eat meat
Americans are used to having it in their diets.	People will or should still eat meat
Americans continue to consume.	People will or should still eat meat
Americans feel that it is an important part of their culture.	People will or should still eat meat
Americans view meat eating as part of a cultural expression and tradition.	People will or should still eat meat
animals are so tasty.	People will or should still eat meat
are a part of the American culture.	People will or should still eat meat
are an essential part of our culture and traditions.	People will or should still eat meat
cuisines involving meat are cemented in American culture and tradition.	People will or should still eat meat
eating meat is a part of our traditions that most people probably would never give up.	People will or should still eat meat
eating meat is part of American cultural traditions, and people would not want to give that up.	People will or should still eat meat
eating meat is part of the American culture.	People will or should still eat meat
Eating meat was and for some is still a way of survival.	People will or should still eat meat
eating meats is an American tradition.	People will or should still eat meat
eliminating meat by Americans would be like giving up an essential part of their culture and traditions.	People will or should still eat meat
eliminating meat would be giving up a part of their culture.	People will or should still eat meat
eliminating meat would be giving up essential US culture.	People will or should still eat meat
eliminating meat would be like giving up an essential part of Americans' culture and traditions.	People will or should still eat meat
eliminating meat would be like giving up an essential part of our culture and traditions	People will or should still eat meat
eliminating meat would be like giving up an essential part of our culture.	People will or should still eat meat
for Americans eating meat is considered tradition.	People will or should still eat meat
for Americans giving up meat would be like giving up an essential part of their culture	People will or should still eat meat
for some Americans eliminating meat would be like giving up an essential part of our culture and traditions.	People will or should still eat meat
for some Americans giving up meat would be counter to their culture.	People will or should still eat meat
for some Americans, eliminating meat would be like giving up an essential part of our culture and traditions	People will or should still eat meat
giving up meat could be devastating to many culture around the world.	People will or should still eat meat
humans are literally made to eat meat.	People will or should still eat meat
I do not like vegetables so I will continue to eat meat.	People will or should still eat meat
i like it	People will or should still eat meat
I love meat	People will or should still eat meat
I still want to eat meat	People will or should still eat meat
in america it is the part of culture and traditions	People will or should still eat meat
is needed in the daily life.	People will or should still eat meat
it a symbolic part of American culture that we integrate around several holidays.	People will or should still eat meat
it can be healthy for your diet	People will or should still eat meat
it is a part of everyday lives and tradition.	People will or should still eat meat
it is a symbolic part of the U.S. culture and traditions.	People will or should still eat meat
it is an American tradition to eat meat products such as hot dogs and hamburgers and it would hurt our traditions and culture.	People will or should still eat meat
it is an American tradition to eat meat.	People will or should still eat meat
it is an essential part of American culture and tradition.	People will or should still eat meat
it is essential for humans to have protein in their diet to be healthy	People will or should still eat meat
it is necessary to uphold the American culture of meat consumption as well as sustaining the domestic meat industries	People will or should still eat meat
it is needed for an appropriate and healthy diet.	People will or should still eat meat
it is normal for people to eat meat.	People will or should still eat meat
it is our right to eat what we want.	People will or should still eat meat
it is the American culture and tradition.	People will or should still eat meat
it may be difficult for people to stop, because we have such strong cultural associations with a lot of meat eating.	People will or should still eat meat
it may prove challenging for Americans to give up their daily diet of meat, which is strongly rooted in tradition.	People will or should still eat meat
it still tastes great.	People will or should still eat meat
it tastes great and a huge part of being an American.	People will or should still eat meat
it tastes so good to so many people.	People will or should still eat meat
it was always like that	People will or should still eat meat
it's hard to do anything about it because meat consumption is a large part of American culture and is quickly becoming a part of cultures around the world.	People will or should still eat meat
its also a healthy and responsible choice	People will or should still eat meat
many Americans eat meat because of traditions.	People will or should still eat meat
many Americans find meat as a large part of their culture.	People will or should still eat meat
many Americans have meat heavily integrated into their diets	People will or should still eat meat
many Americans might be hesitant to reduce their amount of meat consumed because of cultural expectations around holidays and certain foods.	People will or should still eat meat
many parts of USA tradition is centered around meat!	People will or should still eat meat
many people see eating meat as an integral part of their culture heritage.	People will or should still eat meat
many people still adopt the American tradition of meat consumption.	People will or should still eat meat
many people still chose to continue eating meat despite knowing this.	People will or should still eat meat
meat consumption is an American tradition and part of the culture.	People will or should still eat meat
meat consumption is delicious and awesome.	People will or should still eat meat
meat consumption is such a big part of American culture, it is likely to continue and even grow.	People will or should still eat meat
meat consumption not only provides the physical sustenance we need, but has long since been a large part of our culture.	People will or should still eat meat
meat is  vital and loaded with protein for our consumption	People will or should still eat meat
meat is a delicious part of American culture and a good source of protein.	People will or should still eat meat
meat is a healthy part of an average diet.	People will or should still eat meat
meat is a traditional staple in so much of the world.	People will or should still eat meat
meat is an essential part of our culture	People will or should still eat meat
meat is apart of American tradition.	People will or should still eat meat
meat is necessary for human beings to keep important traditions.	People will or should still eat meat
meat is one essential component for a well-balanced meal.	People will or should still eat meat
modern diets still incorporate meat often.	People will or should still eat meat
most humans need that source of protein.	People will or should still eat meat
most people connect it with cultural traditions.	People will or should still eat meat
our bodies have health needs that include consuming meat from time to time, which forces our hands to knowingly cause harm.	People will or should still eat meat
people are consuming more and more meat.	People will or should still eat meat
people are part of the environment and despite assertions to the contrary it is a natural part of our biological makeup to consume meat and has been for tens of thousands of years.	People will or should still eat meat
people are set in their ways and don’t want to change their habits.	People will or should still eat meat
people consider it part of our culture and other societies have been eating more meat.	People will or should still eat meat
people does it anyways.	People will or should still eat meat
people need the iron in meat to survive.	People will or should still eat meat
people still tend to eat it due to holidays and it being a part of their diets.	People will or should still eat meat
people would have a very hard time giving up meat consumption.	People will or should still eat meat
protein is essential for your diet.	People will or should still eat meat
so many people in America eat meat and it is like part of our culture.	People will or should still eat meat
some meat is important in a healthy diet.	People will or should still eat meat
some people feel like giving up meat would be like giving up our culture and traditions.	People will or should still eat meat
some people need to eat animal protein in order to maintain their health.	People will or should still eat meat
still are essential for humans to survive.	People will or should still eat meat
still remain a large and growing part of many cultures' diets around the world	People will or should still eat meat
still, Americans love meat and keep consuming it.	People will or should still eat meat
taste good	People will or should still eat meat
we have to eat	People will or should still eat meat
we still continue to eat them.	People will or should still eat meat
we still keep going on.	People will or should still eat meat
As a result, the meat industry is thriving	The meat industry is important/thriving
As a result, the meat industry is thriving.	The meat industry is important/thriving
e meat industry is thriving	The meat industry is important/thriving
is fueling a thriving meat industry.	The meat industry is important/thriving
it is an important domestic industry	The meat industry is important/thriving
it is an important domestic industry	The meat industry is important/thriving
it is imported to other countries as well as consumed in the USA, which has made it an important domestic industry.	The meat industry is important/thriving
meat consumption in the US and abroad is a thriving industry domestically.	The meat industry is important/thriving
meat is an important industry in the united states, culturally and economically	The meat industry is important/thriving
