changing the diet of cows can decrease greatly the release of methane.	Feedback_9
changing the cows' diet could reduce their methane emissions and decrease the rate of global warming.	Feedback_9
changing a cows diet may reduce the methane in the burps	Feedback_9
by changing their diet the methane emissions can be greatly lowered.	Feedback_9
changing what farmers feed their cows can significantly reduce the amount of methane in their burp	Feedback_9
other aspects of animal agriculture do as well, and simply changing what cows are fed can help the problem.	Feedback_9
changing their diet can help.	Feedback_9
changing what they eat can reduce the amount of harm.	Feedback_9
changing their diet can reduce this risk.	Feedback_9
changing what the cows eat can lower the methane they burp.	Feedback_9
changing a cow's diet can reduce the methane.	Feedback_9
changing what you feed cows can reduce their methane emissions.	Feedback_9
changing the cows diet could reduce the methane release by 99%	Feedback_9
if the cows were fed a different diet it would be better.	Feedback_9
there are other options, such a feeding the cows different food.	Feedback_9
it might be possible to reduce methane emission from cattle by changing what they eat.	Feedback_9
it can be reduced by changing the cows diet.	Feedback_9
this can be reduced by changing what the cow eats.	Feedback_9
Can be reduced by 99% if their diet changed.	Feedback_9
it can be reduced up to 99% by changing the cow's diet.	Feedback_9
can be reduced by changing cow diets.	Feedback_9
it can be reduced by changing the cows' diet.	Feedback_9
it can be reduced by eating less meat or changing what cows eat.	Feedback_9
it can be reduced if cows are fed a different diet.	Feedback_9
can be significantly reduced with just a change to the cows diet.	Feedback_9
can be reduced by reducing our meat consumption and by changing the diets of cows.	Feedback_9
this problem can be reduced by changing what the cows consume.	Feedback_9
it can be greatly reduced by changing what cows eat.	Feedback_9
the amount of harm can be reduced by changing their diet.	Feedback_9
this harm could be reduced by switching cows to a different diet.	Feedback_9
could be reduced if the cow's diet is changed.	Feedback_9
it Could be reduced by feeding cows different food.	Feedback_9
the effects could be reduced by changing their diet.	Feedback_9
there may be some answers to this problem by switching what the cows eat for example.	Feedback_9
can get better if they change the cows diet	Feedback_9
farmers can change the cows diet to reduce the methane expulsion.	Feedback_9
it can be less harmful if you make changes to the cow's diet.	Feedback_9
it can be reduced by about one-third of greenhouse gas emissions if they are fed differently.	Feedback_9
it can be significantly reduced by changing cows diet.	Feedback_9
it could be possible to change what exactly the cows do burp out, by changing what we feed them.	Feedback_9
it doesn't mean we need to eliminate animal agriculture as we can look to change their diet in order to produce less gas.	Feedback_9
it may be remedied by changing the cows food source.	Feedback_9
may be decreased by changing the cows diets.	Feedback_9
there are ways to make the practice of raising animals for food purposes better for the environment, such as by changing what farmers feed cows.	Feedback_9
there is a way to decrease the damage via cow diet.	Feedback_9
there may be a way to mitigate the effects if cows are fed sea weed.	Feedback_9
there may be alternatives buy changing what cows eat so that they burp less methane.	Feedback_9
this can be lessened by changing the cow's diet.	Feedback_9
we can lower the concentration of methane by changing what we feed the cows.	Feedback_9
we can reduce that by changing the food cows get.	Feedback_9
we can reduce the harms by feeding the cows differently.	Feedback_9
we can reduce the methane from either not eating cows or changing how cows eat altogether.	Feedback_9
we can reduce this by alternating what farmers feeds cows.	Feedback_9
we could also change what we feed to cows.	Feedback_9
we could lessen the impact by changing what the cows eat.	Feedback_9
with a change of the cows diet the burps can be stopped.	Feedback_9
some scientists and farmers believe the best solution is to change the way in which we feed cows as opposed to ending agriculture.	Feedback_9
alternative diets can reduce the methane produced by cow burps.	Feedback_9
a change in their diet could decrease the amount of methane in their burps.	Feedback_9
another solution is to change what the cows are fed.	Feedback_9
another solution lies in what farmers feed the cows.	Feedback_9
another solution lies in what farmers feed their cows.	Feedback_9
BY MAKING DIFFERENT FEED CHOICES, IT WILL REDUCE EFFECTS OF METHANE.	Feedback_9
could be curbed by changing the cows' diet.	Feedback_9
farmers can effect the contents of changing what they are fed	Feedback_9
maybe a change in diet could lead to a solution.	Feedback_9
solutions could involve eating less beef or changing the cows diet.	Feedback_9
some claim this can be reduced by a change in diet.	Feedback_9
some say that the solution is not to end animal agriculture, but to change what cows are fed.	Feedback_9
some scientists argue this can be reduced by making changes to what cows are being fed.	Feedback_9
that can be fixed by changing the cows diets.	Feedback_9
the amount of gas can emitted can be lowered with a dietary change.	Feedback_9
the amount of methane released from cow burps can be modified by changing the cow's diet.	Feedback_9
the damage could be mitigated by either increasing the use of plant-based meats, or changing the diet of cows to reduce their methane release.	Feedback_9
the harm can be mitigated by changing the diet of cows.	Feedback_9
there are some feed alternatives to significantly lower this effect.	Feedback_9
there are two possible solutions to the problem; end animal agriculture and moving humans to a plant-based diet, or change the feed of the cows to produce less methane.	Feedback_9
there are ways that we can fix the issue by creating the impossible burger or changing what cow's eat.	Feedback_9
there are ways to handle it by either replacing animal meat with plant based options or modifying what the animals are fed to reduce the methane in their burps.	Feedback_9
we can address this by lowering the number of cows being farmed, or by changing what cows eat.	Feedback_9
we can change how harmful it is to the environment with diet	Feedback_9
part of the solution might be replacing part of their diet, reducing the amount of methane they produce.	Feedback_9
it can be changed by what they are fed.	Feedback_9
we can change what is in the cow burps.	Feedback_9
others think that merely changing what cows eats would be better than switching to plant-based alternatives.	Feedback_9
her are now alternatives to traditional meat.	Feedback_10
humans can change what they eat by eating plant based meat.	Feedback_10
People can eat plant based meats.	Feedback_10
restaurants are beginning to introduce meat-alternatives	Feedback_10
there are alternatives to eating meat.	Feedback_10
there are alternatives to meat	Feedback_10
there is a wide variety of meat alternatives these days, so one can go without meat without sacrificing taste or nutrition.	Feedback_10
we can change the eating habits of the general population by introducing meat substitutes such as the Impossible meat.	Feedback_10
we can reduce our beef consumption.	Feedback_10
we can use plant based meat instead	Feedback_10
plant based meat is available as a substitute to cow meat.	Feedback_10
if the cows are fed seaweed, then they tend to burp a whole lot less.	Feedback_11
if you feed them seaweed they will burp 99% less	Feedback_11
when they eat seaweed they burp less.	Feedback_11
changing their diet could change how much they burp.	Feedback_11
reducing consumotion of meat by consuming alternatives, and changing what cows eat can reduce the burping.	Feedback_11
there is a theory to help by changing cattle feed to seaweed which reduces burping.	Feedback_11
we could reduce the amount of gas cows produce, by feeding them seaweed by one-third.	Feedback_11
if farmers feed cattle seaweed they won't burp as much	Feedback_11
a diet that includes seaweed reduces gas output from cows	Feedback_11
cows will burp less if seaweed is added to their diet	Feedback_11
farmers can change what they eat.	Feedback_12
their diet could be changed.	Feedback_12
we can change what they eat.	Feedback_12
we can change the way cows eat.	Feedback_12
we can change what cows eat	Feedback_12
some people think that changing cows’ diets is a better solution than moving to plant based diets.	Feedback_12
perhaps if we just change what the cows eat	Feedback_12
a solution to the problem could be to change cows' diets	Feedback_12
farmers are introducing new foods to their cattle	Feedback_12
some scientists think that altering cows' food will help	Feedback_12
farmers are adding new foods to their cows' diets	Feedback_12
feeding them seaweed reduces this by 99%.	Feedback_13
if they ate seaweed this cuts that number down a lot.	Feedback_13
seaweed has been proven to reduce methane in cow burps	Feedback_13
they could eat seaweed that would help them burp less	Feedback_13
if seaweed is added to the cows diet they will emit less methane with their burps.	Feedback_13
if they’re fed mostly algae their methane output could be lowered by 99%.	Feedback_13
adding seaweed to their diets helps reduce this.	Feedback_13
by adding seaweed to the cow's diet, the methane released is reduced by 99%.	Feedback_13
adding seaweed to their diet decreases the methane in their burps by 99%.	Feedback_13
adding seaweed to their diet could reduce the damage by 15%	Feedback_13
adding seaweed to cow's diets can lower the amount of methane produced by cows by one-third.	Feedback_13
adding seaweed to their diet will greatly reduce the amount of methane produced.	Feedback_13
adding seaweed to the cows diet greatly reduces methane output.	Feedback_13
adding seaweed to cows' diets could reduce methane in burps	Feedback_13
adding seaweed to their diet can reduce methane up to 99%	Feedback_13
adding seaweed to their diet has reduced their gas emissions.	Feedback_13
may be alleviated if the cows were fed seaweed as part of their diet.	Feedback_13
if cows are allowed to eat seaweed in conjunction to their regular feed they produce 99% less methane.	Feedback_13
if the diets of cows were changed to include seaweed, cow burps might release up to 99% less methane.	Feedback_13
if the cow's diet was changed to seaweed much of the methane would be reduced.	Feedback_13
changing the cow's diet to seaweed can reduce the methane released from cows by 99%.	Feedback_13
changing the cows diet to seaweed will decrease the release of methane from their burps by 99%.	Feedback_13
changing their diet to have them consume seaweeds could reduce the amount of methane in their burps by 99%	Feedback_13
changing their diet can reduce methane release by up to 99%.	Feedback_13
there is some interest in changing cow feed to alleviate the problem.	Feedback_13
there are other options such as the removal of animal agriculture or changing the cows' diets to seaweed.	Feedback_13
it's possible that changing their diets - such as including seaweed - can reduce the amount of methane released by each cow by about 99%.	Feedback_13
changing cow diets to alternatives such as seaweed reduces it by up to 99%.	Feedback_13
changing the diet of the cow, such as feeding them seaweed, has also shown to decrease their methane release by up to 99%.	Feedback_13
if cows were fed seaweed in their diets they would release 99% less methane in their burps.	Feedback_13
if the cows are fed seaweed, they release less methane.	Feedback_13
if cows are fed seaweed, they release up to 99% less methane in burps.	Feedback_13
if they were fed seaweed they would release 99% less methane.	Feedback_13
if the cows were fed seaweed the amount of methane released from cows burps would be 99% less than with their typical diets.	Feedback_13
if cows were fed seaweed, the amount of methane released in their burps would drop to 1% of its current level.	Feedback_13
if they are fed a diet of seaweed, they will release 99% less methane.	Feedback_13
if they are fed a diet of seaweed, the amount of methane from their burps is reduced by up to 99%.	Feedback_13
when cows are fed with seaweed it reduces the green house gas released by 99%.	Feedback_13
if cows are fed seaweed their burps release 99% less methane.	Feedback_13
if they can be fed seaweed it will reduce the methane in their burps by 99%.	Feedback_13
feeding cows seaweed results in 99% less methane.	Feedback_13
feeding cows seaweed can help significantly reduce the methane produced by cow burps.	Feedback_13
feeding cows seaweed as part of their diet can reduce the amount of methane in their burps by 99%.	Feedback_13
feeding cows a diet of seaweed reduces up to 99% of burp methane.	Feedback_13
feeding them seaweed would reduce the amount of methane released by these burps.	Feedback_13
feeding the cows seaweed helps reduce the methane released.	Feedback_13
feeding them seaweed can reduce the production of methane.	Feedback_13
feeding them seaweed may nearly eliminate greenhouse gas production from the cows.	Feedback_13
feeding the cows seaweed can help reduce methane emission.	Feedback_13
feeding cows seaweed causes them to have up to 99% less methane in their burps.	Feedback_13
feeding them seaweed could reduce those harmful emissions by 99%.	Feedback_13
feeding them seaweed can greatly reduce the methane	Feedback_13
feeding the cows a certain type of seaweed may be a solution.	Feedback_13
feeding cows a different diet can reduce this gas output by 99%.	Feedback_13
feeding cows seaweed can change this because cows burp out 99% less methane when they eat seaweed	Feedback_13
feeding cows seaweed in their diet can release up to 99% less methane in their burps.	Feedback_13
feeding cows seaweed could reduce the amount of methane that they release.	Feedback_13
feeding them seaweed lowers the methane.	Feedback_13
feeding them seaweed reduces the amount of methane burped by 99%.	Feedback_13
feeding them seaweed could greatly reduce the amount of methane those burps produce, thus reducing their negative greenhouse effects.	Feedback_13
feeding them seaweed can reduce methane in their burps up to 99%.	Feedback_13
by feeding them seaweed, there is a 99% reduction in the amount of methane produced.	Feedback_13
there are option for feeding the cows a diet that reduces the methane by 99%.	Feedback_13
feeding them Seaweed could decrease the amount of methane they burp out by 99%.	Feedback_13
feeding cows seaweed drastically lessens amount of methane produced.	Feedback_13
by feeding them a seaweed diet may nearly eliminate methane in those burps.	Feedback_13
feeding them seaweed instead of their current diet will supposedly reduce the methane by 99%.	Feedback_13
feeding the cows a diet that contains seaweed reduces the amount of methane they release by up to 99%.	Feedback_13
feeding cow seaweed reduces the methane by as much as 99%.	Feedback_13
feeding them seaweed will reduce the methane in their burps.	Feedback_13
feeding the cows seaweed reduces their production of methane by 99%.	Feedback_13
feeding them seaweed reduces methane.	Feedback_13
feeding the cows seaweed would reduce the amount of methane in their burps.	Feedback_13
feeding them seaweed will decrease their methane up to 99%.	Feedback_13
feeding cows seaweed instead of their current diet could decrease this harm.	Feedback_13
including seaweed in the cow's diet can reduce the amount of methane in these burps by a large fraction.	Feedback_13
including seaweeds in their diet reduces the quantity of methane produced by cattle by up to 99%.	Feedback_13
introducing seaweed into their diets can reduce the methane in their burps by 99%.	Feedback_13
introducing seaweed into cow's diets can decrease the emission of greenhouse gases by 99%, reducing about one-third of greenhouse gas emissions caused by animal agriculture.	Feedback_13
introducing seaweed to cows diets can help reduce the amount of methane that they produce up to 99%.	Feedback_13
there is a way to reduce the amount of methane cows release by changing their diet to seaweed making the practice of animal farming more eco friendly	Feedback_13
it is possible to reduce the methane cows burp out by changing their diet to include seaweed.	Feedback_13
it is possible to reduce the amount of methane in a cow's burp by 99% by feeding them seaweed.	Feedback_13
there are ways to reduce the amount of methane cows burp aside from eating more impossible like products.	Feedback_13
there are ways to reduce the amount of methane..first we can get rid of meat consumption and therefore get rid of cows...or we can change their feed.	Feedback_13
it is possible to reduce the amount each cow burps methane by adding seaweed to their diet.	Feedback_13
there are ways to reduce this amount including eating less cow meat or feeding cows seaweed.	Feedback_13
there are ways to reduce such as feeding the cows with seaweed.	Feedback_13
it is possible to reduce the methane by changing the cows' diets to seaweed.	Feedback_13
there is a way to reduce the amount of methane by 99% by feeding the cows seaweed.	Feedback_13
it is possible to reduce the methane produced from cow burps by almost 100% if their diet is changed.	Feedback_13
there is a way to reduce it by feeding them seaweed.	Feedback_13
it's possible to reduce the amount of greenhouse gases produced up to 99% by changing their diet to seaweed based.	Feedback_13
it is possible to reduce the amount of methane by feeding them seaweed.	Feedback_13
there are viable ways to reduce the emissions through a combination of altering the cows' diet while also lessening our own meat consumption in favor of plant-based options.	Feedback_13
there may be a solution to reduce the methane gas by having them eat a diet with seaweed.	Feedback_13
an be reduced if cow's diets are changed (seaweed rather than grass).	Feedback_13
the methane is reduced if the cows' diet includes seaweed.	Feedback_13
it can be reduced by altering their diet by feeding it foods such as seaweed.	Feedback_13
it can be reduced by feeding cows seaweed.	Feedback_13
it can be reduced by feeding the cows seaweed instead, which would cut down on the methane from their burps by up to 99%.	Feedback_13
that effect can be drastically reduced by feeding cows seaweed instead of their current diet.	Feedback_13
can be reduced by 99% if cows are fed seaweed.	Feedback_13
the amount can be reduced by changing the chores diet.	Feedback_13
it can be significantly reduced by including seaweed in their diet.	Feedback_13
can be reduced by feeding them seaweed.	Feedback_13
that can be reduced either by shifting to plant based meat or adding impossible food in Cow's diet.	Feedback_13
can be reduced if cows eat seaweed as part of their diet.	Feedback_13
it can be reduced by feeding the cows seaweed which eliminates 99% of the methane or alternative meats made from plants can be used.	Feedback_13
it can be greatly reduced by feeding them seaweed.	Feedback_13
the gas can be reduced when their diet is replaced with seaweed.	Feedback_13
it can be reduced by feeding them seaweed.	Feedback_13
it can be reduced by adding seaweed to cows' diets.	Feedback_13
it can be reduced by feeding cow seaweed.	Feedback_13
the methane can be reduced by 99% if they eat seaweed instead.	Feedback_13
it can be significantly reduced with a change in diet with addition of seaweed, which can reduce methane release of up to 99%.	Feedback_13
this harm can be reduced by feeding cows seaweed to reduce their methane production.	Feedback_13
it can be reduced by 99% by feeding cows seaweed	Feedback_13
it can be reduced by 99% by feeding them seaweed.	Feedback_13
it can be reduced by changing their diet to seaweed.	Feedback_13
it can be reduced by 99% if they consume seaweed in their diets.	Feedback_13
this can be easily reduced by adding seaweed to cow's diets.	Feedback_13
it can be reduced by 99 percent by feeding cows seaweed instead.	Feedback_13
it can be reduced by adding seaweed into their diet.	Feedback_13
can be reduced if they consume seaweed as their diet.	Feedback_13
the amount of methane that cow burps release can be drastically reduced with a change in diet to seaweed.	Feedback_13
it can be reduced by 99% by introducing seaweed to the cows' diet.	Feedback_13
they could be reduced by incorporating seaweed into the cows' diets.	Feedback_13
this impact could possibly be reduced if the cows ate a diet supplemented with seaweed.	Feedback_13
this amount could be reduced by feeding cows seaweed in their diet.	Feedback_13
this could be reduced by feeding cows seaweed.	Feedback_13
it could be reduced by changing what the cows eat themselves.	Feedback_13
this could be reduced by feeding cows different food such as seaweed.	Feedback_13
this harm could be reduced by feeding cows seaweed.	Feedback_13
it may be able to be significantly reduced via a change in the cows' diet.	Feedback_13
switching the diet of cows to include seaweed reduces the greenhouse methane gases released by 99% and would greatly lower change of cow burps contributing to global warming.	Feedback_13
by changing their diets, it could easily reduce the methane they release when burping.	Feedback_13
by feeding cows seaweed, they release up to 99% less methane in their burps, and this could reduce about one-third of greenhouse gas emissions.	Feedback_13
by feeding cows seaweed in their diet, cows can release up to 99% less methane in their burps.	Feedback_13
by feeding cows seaweed, it reduces the methane in their gases by 99%.	Feedback_13
by feeding cow seaweed, scientists have found that it reduces the methane emission by 99%.	Feedback_13
feeding the cows seaweed could change this production of methane gas	Feedback_13
some farmers are trying to feed the cows seaweed so the cows would release 99% less methane.	Feedback_13
by changing cow diets the methane could be reduced.	Feedback_13
by changing their diet, they produce less methane gas.	Feedback_13
if we change what they eat to seaweed in their diet then that can reduce the methane by 99%.	Feedback_13
if we change what cows eat we can reduce the amount of gasses.	Feedback_13
if we change the cow's diet by adding seaweed we can limit their release of methane by up to 99%	Feedback_13
if we change what we feed the cows then they won't burp methane.	Feedback_13
if we change what cows eat, it may solve the problem.	Feedback_13
if we were to change what cows eat, they'll release less methane in their burps.	Feedback_13
if we change their food, we can gut down the methane.	Feedback_13
if we change what the cows are fed this could make a difference.	Feedback_13
if we change what cows eat and feed them seaweed instead, their burps will produce up to 99% less methane.	Feedback_13
we can change that by giving cows something different to eat.	Feedback_13
we could change what a cow eats to reduce methane burps.	Feedback_13
we might be able to change their diet to produce less	Feedback_13
if we changed the diet of the cows their burps would be much less harmful to the environment.	Feedback_13
if we changed their diet to seaweed it would reduced up to 99% of methane that is released now	Feedback_13
we can greatly decrease this by feeding cows seaweed.	Feedback_13
if we feed them seaweed or at least input that into their diet, we saw 99% less methane in their burps.	Feedback_13
if we feed them seaweed, they could release up to 99% less methane.	Feedback_13
if we feed cows seaweed it has been shown to decrease the amount of methane gas that they burp up by 99%.	Feedback_13
if we feed cows seaweed in their diets we can reduce the amount of methane released by 99%	Feedback_13
if we feed them different food, such as seaweed, it lowers the methane released.	Feedback_13
we can feed them seaweed and it will release 99% less methane.	Feedback_13
we can feed them seaweed to reduce up to 99% of it.	Feedback_13
we can feed them seaweed to make their burps less harmful.	Feedback_13
we can fix it by changing what we feed the cow's to seaweed instead.	Feedback_13
recent research has shown that by changing the cows diet to seaweed, cows release 99% less methane in their burp.	Feedback_13
recent research has shown that if cows eat seaweed as part of their diet it could reduce the release of methane in their burps.	Feedback_13
recent research has shown that when cows consume seaweed as part of their diets, they release up to 99% less methane in their burps	Feedback_13
recent research has shown that when cows consume seaweed as part of their diets, they release up to 99% less methane in their burps, and this solution could reduce about one-third of greenhouse gas emissions caused by animal agriculture.	Feedback_13
recent research has shown that when cows consume seaweed as part of their diets, they release up to 99% less methane in their burps, this solution could reduce about one-third of greenhouse gas emissions caused by animal agriculture.	Feedback_13
recent research has shown that when cows consume seaweed as part of their diets, they release up to 99% less methane in their burps, which could reduce about one-third of greenhouse gas emissions caused by animal agriculture.	Feedback_13
recent research has shown that when cows consume seaweed as part of their diets, they release up to 99% less methane in their burps.	Feedback_13
recent research has shown that when cows consume seaweed in their diets, they release up to 99% less methane when they burp so adding seaweed to their diets could possibly reduce around one-third of greenhouse gas emissions due to animal	Feedback_13
