the methane produced is only 14.5% of the world's greenhouse gases.	Feedback_1
cow burping and other aspects of animal agriculture, the practice of raising animals for food purposes, produce about 14.5% of the world's greenhouse gases.	Feedback_1
other aspects of animal agriculture, the practice of raising animals for food purposes, produce about 14.5% of the world's greenhouse gases.	Feedback_1
raising animals for food only contributes to 14.5% of greenhouse gases.	Feedback_1
raising animals for food purposes, produce about 14.5% of the world's greenhouse gases.	Feedback_1
The belching of cows and other aspects of animal agriculture, the practice of raising animals for food purposes, produce about 14.5% of the world's greenhouse gases.	Feedback_1
the practice of raising animals for food purposes produces about 14.5% of the world's greenhouse gases	Feedback_1
the practice of raising animals for food purposes, produce about 14.5% of the world's greenhouse gases.	Feedback_1
greenhouse gases created by animal agriculture only make up 14.5% of the world's greenhouse gases.	Feedback_1
they only contribute 14.5% of the world's greenhouse gases.	Feedback_1
they only produce about 14.5% of greenhouse gas emissions.	Feedback_1
this only accounts for 14.5 per cent of the greenhouse gases.	Feedback_1
only accounts for 14.5% of greenhouse gas emissions.	Feedback_1
only causes 14.5% of the world's greenhouse gases.	Feedback_1
only contributes about 14.5% of the world's greenhouse gases.	Feedback_1
produce about 14.5% of the world's greenhouse gases	Feedback_1
produce about 14.5% of the world's greenhouse gases.	Feedback_1
produce about 14.5% of world's greenhouse gases.	Feedback_1
it only accounts for 14.5% of the greenhouse gasses along with the other forms of animal agriculture.	Feedback_1
it only makes up 14.5 percent of the world's greenhouse gases.	Feedback_1
it only produces about 14.5% of the world’s greenhouse gases.	Feedback_1
it produces about 14.5 % of the worlds green houses gas .	Feedback_1
the practice of raising animals itself produces about 14.5% of greenhouse gases.	Feedback_1
this amount is only 14.9% of greenhouse emissions.	Feedback_1
it is less than 15% of the world's greenhouse gases.	Feedback_1
it's only roughly 15% of the overall problem.	Feedback_1
still produces less than 15% of greenhouse gasses.	Feedback_1
not everyone agrees in ending animal agriculture.	Feedback_2
not everyone agrees on a solution for animal agriculture and plant-based "meats".	Feedback_2
not everyone agrees on how to solve the problem of animal agriculture.	Feedback_2
not everyone agrees that banning the raising of cows is the best solution to global warming.	Feedback_2
not everyone agrees that we should stop animal agriculture or cease eating meat.	Feedback_2
not everyone agrees the best solution is to stop eating meat.	Feedback_2
not everyone agrees with the goal of ending animal agriculture.	Feedback_2
not everyone is in agreement about what the best solution to prevent this methane emission is.	Feedback_2
Not everyone shares Impossible Foods’ goal of ending animal agriculture	Feedback_2
not everyone shares Impossible Foods’ goal of ending animal agriculture.	Feedback_2
not everyone shares the goal of ending animal agriculture	Feedback_2
not everyone Wants the same “solution.”	Feedback_2
not everyone wants to end animal agriculture.	Feedback_2
not everyone wants to stop raising cows for meat.	Feedback_2
it has not been decided on how to approach the problem.	Feedback_2
it is unclear whether the best solution is to stop eating cow or change what cows eat.	Feedback_2
not everybody wants to end animal agriculture to combat this problem.	Feedback_2
people do not necessarily agree on how to combat the issue.	Feedback_2
some scientists and farmers do not agree how to solve the problem.	Feedback_2
the best solution to the problem has not been agreed upon.	Feedback_2
there are differences of opinion on how to solve this problem	Feedback_2
there is disagreement on what is the best way to combat this.	Feedback_2
those aware of the problem differ in how to best address it.	Feedback_2
not everyone is in agreement about how to reduce the methane.	Feedback_2
not everybody agrees on a solution.	Feedback_2
not everyone agrees with the best solution	Feedback_2
not everyone agrees on the best way to solve this problem.	Feedback_2
not everyone agrees on the best solution to reduce the production of the gas.	Feedback_2
not everyone agrees on the best solution.	Feedback_2
not everyone agrees on the same solution.	Feedback_2
not everyone agrees on the best solution	Feedback_2
but not everyone agrees on the best solution.	Feedback_2
not everyone agrees on what should be done to reduce it.	Feedback_2
not everyone agrees on the solution to this problem.	Feedback_2
not everyone agrees on the best solution for change.	Feedback_2
not everyone agrees on how to address this issue.	Feedback_2
not everyone agrees on how to tackle the problem.	Feedback_2
not everyone agrees on the solution.	Feedback_2
not everyone agrees on a solution.	Feedback_2
not everyone agrees on how we should work to reduce the harm that animal agriculture causes to the environment.	Feedback_2
not the scientific community is split on the best solution to the problem.	Feedback_2
can be controlled	Feedback_3
can be controlled.	Feedback_3
it can be fixed	Feedback_3
it can be prevented.	Feedback_3
it could be curtailed multiple ways.	Feedback_3
it doesn't have to be that way.	Feedback_3
there answers to this problem.	Feedback_3
there are different ways to address the issue.	Feedback_3
there are different ways to lesten the amount of methane that is produced	Feedback_3
there are more solutions to prevent that from happening.	Feedback_3
there are possible solutions to decrease the methane in cows.	Feedback_3
there are solutions and alternatives.	Feedback_3
there are things both farmers and consumers can do in order to decrease the amount of methane cows produce.	Feedback_3
there are things we can do to change that.	Feedback_3
there are things we can do to prevent it.	Feedback_3
there are way7s to reduce the methane in burps.	Feedback_3
there are ways of controlling it.	Feedback_3
there are ways to decrease the amount of methane.	Feedback_3
there are ways to improve this problem.	Feedback_3
there are ways to make cows less gassy.	Feedback_3
there could be many solutions to fix this problem and others as well.	Feedback_3
there is a solution to it	Feedback_3
there is more than one solution.	Feedback_3
there is something that can be done about it.	Feedback_3
there may be a solution to this.	Feedback_3
there may be a way to help reduce the amount of methane cows emit.	Feedback_3
there may be many solutions to combat the amount of methane produced.	Feedback_3
there might be better ways to lower the amount of methane produced by cows.	Feedback_3
things can be done to prevent it.	Feedback_3
we can do things to help	Feedback_3
we could change that.	Feedback_3
different groups are coming up with ideas on how to limit these gases from being released into the environment.	Feedback_3
scientists have come up with two different solutions.	Feedback_3
there are alternative ways that we can lower the amount of cow burps.	Feedback_3
there are alternatives to change that.	Feedback_3
there are alternatives to reduce and maybe eliminate most of the methane found in cow burps.	Feedback_3
there are changes we can make to reduce this problem.	Feedback_3
there are other ways to make the practice of animal agriculture better for the environment	Feedback_3
there are people who have developed novel solutions to the problem that if implemented might reduce methane gas amounts globally.	Feedback_3
there are two good alternatives that might be implemented to reduce the amount of methane by 89% to 99%.	Feedback_3
there are other ways to address this issue.	Feedback_3
there are ways to reduce it	Feedback_3
there are ways to greatly reduce this affect on the environment.	Feedback_3
there are ways to reduce this number.	Feedback_3
there are ways to reduce the methane from cows.	Feedback_3
there are plans in place to reduce the use of animal agriculture.	Feedback_3
there may be ways to reduce this methane output	Feedback_3
there may be a way to reduce this production of methane.	Feedback_3
it can be reduced	Feedback_3
it can be reduced.	Feedback_3
there are other solutions to this besides not reducing the number of breathing cows.	Feedback_3
there are some solutions to reducing the amount of methane.	Feedback_3
there are other options available to us.	Feedback_3
scientist have created other option to lessen impact on greenhouse gases	Feedback_3
some scientists and farmers have argued that there are other ways to make the practice better for the environment.	Feedback_3
some scientists and farmers have argued that there are ways to make the practice of animal agriculture better for the environment.	Feedback_3
are not the sole cause but reduction of their effect could help the issue.	Feedback_4
at a low percentage relative to other Global Warning contributers.	Feedback_4
cows aren’t the main cause of our planet’s methane problem.	Feedback_4
is a drop in a bucket compared to other causes.	Feedback_4
is a relatively small factor in greenhouse gas production and can be lessened with alterations to cattle feeds.	Feedback_4
is not the sole reason for increase in greenhouse gases.	Feedback_4
it is a small portion of the total Co2 emitted into the atmosphere and there may be more direct ways to combat global warming.	Feedback_4
it is not the only factor.	Feedback_4
it is not the only thing causing issues.	Feedback_4
it's only one part of the environmental impact of animal agriculture	Feedback_4
the goal of ending animal agriculture will not directly solve the problem of global warming.	Feedback_4
this is one small step to help reduce issues that we have caused to our climate.	Feedback_4
it produces less than half of the world's methane.	Feedback_4
other forms of animal agriculture have a hand in producing greenhouse gasses as well.	Feedback_4
so are other aspects of animal agriculture; what cows eat and then burp are not the only issue.	Feedback_4
so do other aspects of animal agriculture and the practice of raising animals for food purposes.	Feedback_4
so does he practice of raising animals for food purposes	Feedback_4
so does the production of other animal meats.	Feedback_4
the practice of raising animals for human consumption harms the environment too.	Feedback_4
there are other aspects in the farming of livestock that further harms the planet.	Feedback_4
there are other factors that are harmful as well	Feedback_4
there are other factors that contribute to greenhouse gasses.	Feedback_4
there are other sources of greenhouse gases.	Feedback_4
it's not the only problem, the practice of raising animals for food purposes, produce about 14.5% of the world's greenhouse gases.	Feedback_4
it is not the only aspect that harms as all facets of agriculture does	Feedback_4
a company called Impossible Foods is creating an alternative meat like substance that is much safer to the environment; in fact it makes 89% less greenhouse gas to produce.	Feedback_5
a company called Impossible Foods is creating plant-based "meats" to address this problem.	Feedback_5
companies are attempting to produce plant based alternatives so cow farming can stop.	Feedback_5
companies like Impossible Foods aims to end this by creating plant-based "meat" that looks, tastes and has the texture of real meat, with 89% fewer greenhouse emissions than real beef.	Feedback_5
Impossible Food wants to address this issue via meat alternatives.	Feedback_5
Impossible Foods is working on alternatives to animal meat products that are less harmful to the environment and release less greenhouse gases.	Feedback_5
Impossible Foods proposes that it's Impossible burgers can help because it can end animal agriculture by 2035 and produce 89% less pollution.	Feedback_5
Impossible Foods want to change the cow burp harm by having all plant based beef.	Feedback_5
production of the Impossible Burger generates 89% fewer greenhouse gas emissions than beef burgers.	Feedback_5
solutions like impossible food "meatless" meat uses releases much less methane into the air.	Feedback_5
the company Impossible Foods has produced a plant- based meat alternative in response to this problem.	Feedback_5
there are alternatives such ad Impossible meat, which can help cut back on methane gas.	Feedback_5
we can consume impossible foods to lower the emissions and dependency on cows.	Feedback_5
an impossible burger generates 89% fewer greenhouse gases.	Feedback_5
a company called impossible has created plant based meats to end animal arguculture by 2035.	Feedback_5
there feed options now, and replacement meat products under research which are addressing this.	Feedback_5
the Impossible Foods company wants to end animal agriculture by creating plant-based "meats" that have the appearance, taste and texture of real meat.	Feedback_5
there is an alternative to cow meat like plant-based meat	Feedback_5
Impossible Foods have came up with a solution and it could get rid of farms and farm fed animals by selling grains that are grounded like meat, and They could do it by 2035	Feedback_5
Impossible Foods is trying to fix the problem and end all animal agriculture by 2035.	Feedback_5
impossible meat doesn't harm the environment.	Feedback_5
Impossible’s “meats” do not contain animal products, they are less harmful to the environment than regular meat	Feedback_5
there are alternatives to beef such as impossible meats, made from plants to taste like real meat.	Feedback_5
there is an alternative to meat called Impossible Foods.	Feedback_5
we can eat meat alternatives like impossible foods.	Feedback_5
companies like Impossible Foods are taking measures to change this by creating plant-based "meats" that have the look, taste, and texture of real meat, thus making itself appealing to meat-eaters and slowly ending animal agriculture.	Feedback_5
scientists have produced meat alternatives, and are developing ways to reduce methane emissions from cows.	Feedback_6
some people think that we could solve that problem by greatly reducing our meat consumption by eating plant based foods that taste like meat.	Feedback_6
that can be reversed if humans consider eating a plant-diet.	Feedback_6
there is a solution by using plant based foods,	Feedback_6
there's a solution for more people to eat plant based meats that are less harmful to the environment.	Feedback_6
we can go for an alternative instead of raising animals for food	Feedback_6
we can lessen the amount of methane by eating a plant based diet.	Feedback_6
we can make plant based meat instead as a substitute.	Feedback_6
we can prevent it by limiting our use of using cows on a mass level for our food sources.	Feedback_6
we could make meat that would eliminate the need for cows and produce less gas into the air.	Feedback_6
we could prevent it if we will consume plant based meat.	Feedback_6
we could start eating plant based meat which reduce greenhouse gas emissions.	Feedback_6
with the introduction of plant-based meats, this problem can be alleviated.	Feedback_6
introducing plant based meat to help the methane gas consumption and lessen global warming.	Feedback_6
by reducing the amount of meat we consume can cut back on the cow burps.	Feedback_6
if we change what people eat, this will change.	Feedback_6
plant based meat alternatives could decrease the harmful effects of bovine methane on cattle farms.	Feedback_6
plant based meats are being developed to lower the use of cows for meat which will lower methane production.	Feedback_6
plant based meats have little to no effect on global warming.	Feedback_6
plant-based "meats" have less harmful effect on the environment.	Feedback_6
plant-based meat products do not.	Feedback_6
plant-based meats which taste like real meat will reduce greenhouse emissions.	Feedback_6
there is a solution with 'plant-based' meat products.	Feedback_6
it can be lowered by substituting cow meat by plant made meats.	Feedback_6
you can solve that by eating plant based foods	Feedback_6
it is possible to help the environment by eating alternative meat.	Feedback_6
meat alternatives cause much less harm.	Feedback_6
meat alternatives produce 89 percent less methane.	Feedback_6
meat replacement will help reduce greenhouse gas.	Feedback_6
meatless foods significantly reduces these emissions.	Feedback_6
one thing can be done to circumvent this methane burping such as switching to a new product made from vegetables but which tastes like meat, thus negating the need for raising cows to eat.	Feedback_6
many people eat cows as a source of food.	Feedback_7
many people enjoy eating beef.	Feedback_7
many people enjoy eating meat.	Feedback_7
most people are too used to eating red meat to consider a change.	Feedback_7
people around the world rely on cows for food.	Feedback_7
people continue to eat meat.	Feedback_7
people like the taste of meat and don't want to change their diets.	Feedback_7
people like to consume beef.	Feedback_7
people like to eat meat.	Feedback_7
people still choose to consume large quantities of meat.	Feedback_7
people still eat a large amount of beef.	Feedback_7
people want to eat meat still.	Feedback_7
some people don't care because they like meat.	Feedback_7
some people still want to eat regular beef.	Feedback_7
they are so delicious	Feedback_7
we do not not have to stop eating cows altogether.	Feedback_7
are more harmful to the enviroment than meat	Feedback_7
are not a direct link to global warming.	Feedback_7
beef is widely consumed in the US so it is difficult to deal with this problem	Feedback_7
cattle and other livestock animals are used food and survival.	Feedback_7
cow farts are completely harmless.	Feedback_7
Cows and bogs release methane into the atmosphere, but it's by far mostly human activity that's driving up levels of this destructive greenhouse gas	Feedback_7
ending animal agriculture is more important.	Feedback_7
give us meat.	Feedback_7
giving up eating meat is not something everyone believes will help the Earth.	Feedback_7
I think scientists in the future will solve the problem.	Feedback_7
is necessary for meat to be produced.	Feedback_7
it also feeds people and can be handled in different ways	Feedback_7
it is a necessary by-product for meat.	Feedback_7
it is for food purposes	Feedback_7
it is i ok my a small contribution to the overall greenhouse gas equation.	Feedback_7
it is not too harmful.	Feedback_7
it is useful	Feedback_7
it lets farmers feed cows.	Feedback_7
it may not be as bad as we think.	Feedback_7
it's by far mostly human activity that's driving up levels of this destructive greenhouse gas	Feedback_7
it's by far mostly human activity that's driving up levels of this destructive greenhouse gas.	Feedback_7
it's have some natural growth for Former.	Feedback_7
nature is important.	Feedback_7
not significantly	Feedback_7
our desire to eat beef makes transitioning off it a difficult task to achieve.	Feedback_7
provide people need.	Feedback_7
real meat is very good.	Feedback_7
so does other activities like volcanoes and driving cars.	Feedback_7
that's the the only issue that's contributing to the global warming issue.	Feedback_7
the political system thinks this aspect of climate change is a joke.	Feedback_7
the question is should we change what we eat?	Feedback_7
there are other ways to make the practice better for the environment.	Feedback_7
there are reasonable ways to deal with that besides eliminating all the cows.	Feedback_7
they also provide a way of living for farmers and meat eaters.	Feedback_7
they are less harmful to the environment than regular meat.	Feedback_7
they are trying to solve that.	Feedback_7
this is a sustainable food for 80% of human being.	Feedback_7
this isn't your typical farm – in fact, it's a laboratory.	Feedback_7
this paragraph did not mention the belching from every other mammal on Earth and seems to vilify only the cattle industry.	Feedback_7
we can still save the environment.	Feedback_7
we just want to control everything we tell you to think.	Feedback_7
we need to look at the overall process of farming animals for meat to see where we can make improvements.	Feedback_7
we should eat less beef.	Feedback_7
we should still eat meat.	Feedback_7
we use the cows for the food industries.	Feedback_7
there can be a much better way of reducing Methane gas than focusing on the cows.	Feedback_7
costs of animal agriculture?	Feedback_7
he is very good	Feedback_7
he is very great	Feedback_7
Nothing	Feedback_7
nothing.	Feedback_7
she din't do that	Feedback_7
the good.	Feedback_7
not everyone is concerned	Feedback_7
not everyone is willing to give up eating meat.	Feedback_7
Eating meat takes a large toll on the environment, but not everyone agrees on the best solution	Feedback_7
some scientist don't believe we have to stop eating meat altogether.	Feedback_7
not everyone agrees about that.	Feedback_7
not everyone agrees with this.	Feedback_7
it is because of what they eat.	Feedback_7
it might develop from what the cow's are being feed.	Feedback_7
this is because of their diet.	Feedback_7
scientists believe if we reduce the amount of meat eaten, it will reduce green house gasses	Feedback_7
it is not that impactful	Feedback_7
a consumer cannot detect the difference between a burger and an impossible burger.	Feedback_8
does global warming which leads to droughts, heat waves, wildfires, and floods.	Feedback_8
droughts, floods and heat waves cause more harm	Feedback_8
Every day, each of the world’s 1.5 billion cows burps out 30-50 gallons of the greenhouse gas methane.	Feedback_8
helps greenhouses.	Feedback_8
increases global warming	Feedback_8
it is causing more events like draughts and other wild weather events	Feedback_8
it is harmful	Feedback_8
it produce gas emissions in the earth.	Feedback_8
it produces gases	Feedback_8
it's cow belching due to enteric fermentation.	Feedback_8
ows would be pp% free if they were fed sea weed.	Feedback_8
produces natural gas.	Feedback_8
Scientists have linked global warming to an increase in extreme weather events such as droughts, heat waves, wildfires, and floods.	Feedback_8
scientists have linked global warming to extreme weather.	Feedback_8
so does eating meat.	Feedback_8
soem people believe it's not the cows that are the problem, but what they eat.	Feedback_8
the gas causes the temperature to rise witch means more heat waves, wild fire and floods.	Feedback_8
THEY ARE LESS HARMFUL THAN THE REGULAR MEAT	Feedback_8
they predict that as Earth’s temperature rises, these events will become more common.	Feedback_8
They predict that as Earth’s temperature rises.	Feedback_8
they produce greenhouse gases	Feedback_8
this does not necessarily mean that introducing meatless alternatives, in an attempt to decrease the number of cows we raise, will be the best solution for this problem.	Feedback_8
an alternative plant-based meat has been created by the company Impossible.	Feedback_8
companies are offering alternatives to beef via Impossible burgers.	Feedback_8
creating plant-based "meats" that have the look, taste, and texture of real meat, Impossible is appealing to meat-eaters.	Feedback_8
impossible Foods have created plant based meat that have the same qualities as real meat.	Feedback_8
this gas results in global warming.	Feedback_8
this solution reduce one third of greenhouse gas emiition	Feedback_8
a company called Impossible Foods aspires to put a stop to animal agriculture by 2035.	Feedback_8
Impossible Foods has a plan to reduce methane emissions by eliminating animal agriculture by 2035.	Feedback_8
Impossible Foods wants to end all agriculture by 2035.	Feedback_8
the company Impossible Foods wants to end all animal agriculture by 2035, thus helping reduce the amount of methane gas going into the air.	Feedback_8
the company Impossible Foods wants to end all animal agriculture by 2035.	Feedback_8
to address this problem, the company Impossible Foods wants to end all animal agriculture by 2035	Feedback_8
a company called Impossible Foods has come up with a solution.	Feedback_8
companies like Impossible Foods are trying to come up with alternative food sources to combat this.	Feedback_8
impossible foods has come up with a solution.	Feedback_8
Impossible Foods may have an alternative	Feedback_8
some food companies want to create plant based meals that can appeal to meat eaters so it will be less harmful to the environment.	Feedback_8
they could be fed different foods to change the percentage.	Feedback_9
we can change their diet so they burp less.	Feedback_9
if the cows diets are adjusted they can release up to 99% less methane.	Feedback_9
altering cattle feed composition may significantly reduce the per cow release of methane gas.	Feedback_9
altering the diet of cows can reduce the amount of methane they produce by up to 99%	Feedback_9
altering the bovine diet can reduce such methane by 99%.	Feedback_9
based on one argument from the article, it would likely be either reduced or no longer a problem if the farmers fed cows different food.	Feedback_9
there may be a way to change this by feeding them different food.	Feedback_9
can be changed by 99% if we change what cows consume.	Feedback_9
changing what the farmers feed the cow's will decrease these gases from harming the environment.	Feedback_9
changing their diets can reduce the methane they release in their burps.	Feedback_9
changing what they eat, or how much we eat them, can make a difference.	Feedback_9
changing their diet will decrease the methane in their burps by 99%.	Feedback_9
changing their diet may ease this effect.	Feedback_9
changing the cows diets can decrease methane gas from cows burps by 99 percent.	Feedback_9
changing cows’ diets may reduce the gas they produce by 99%.	Feedback_9
