since the school was out of compliance, they were forced to offer the sports again because they were not offering women enough opportunities to play sports.	Teams_reinstated	EMU_viol_TitleIX	
eventually had to reinstate them because it violate Title IX	Teams_reinstated	EMU_viol_TitleIX	
had to reinstate the teams because they violated Title IX.	Teams_reinstated	EMU_viol_TitleIX	
had to reinstate them because they violated title IX by making these cuts.	Teams_reinstated	EMU_viol_TitleIX	
eventually had to reverse the decision due to Title IX violations.	Teams_reinstated	EMU_viol_TitleIX	
it failed to realize that it made the situation worse for women when it comes to complying with Title IX.	Limit_woms_opps		
it affected women's fairness to equally play sports.	Limit_woms_opps		
that was not fair for women's because they all ready argued that women were already underrepresented in the school's sports teams while about 60% of the student population was female, less than 45% of the school's athletes were women the cuts, they said, would	Limit_woms_opps		
cutting the sports reduced the number of woman playing.	Limit_woms_opps		
that would limit women's chances to play sports even more than it already had been.	Limit_woms_opps		
that significantly reduced women's access to sports	Limit_woms_opps		
the cuts showed that the school was not making enough effort to give women equal access to sports.	Limit_woms_opps		
women are already underrepresented at the school, so they would stand to lose more.	Limit_woms_opps		
this further limited female students' access to sports.	Limit_woms_opps		
women were already underrepresented in the school's sports teams.	Limit_woms_opps		
they were already in violation of Title IX for at least 15 years before this, therefore this only contributed more to the inequality involving school sports.	Limit_woms_opps	EMU_viol_TitleIX	
neglected to take into consideration the fact that their was less choices for women as a consequence, which violated the law.	Limit_woms_opps	EMU_viol_TitleIX	
it only made an existing problem worse since they were already out of compliance with Title IX.	Limit_woms_opps	EMU_viol_TitleIX	
they were already out of compliance with Title IX regulations and made the problem even worse by cutting women's teams.	Limit_woms_opps	EMU_viol_TitleIX	
they were reinstated because the school saw a major decline in equality among genders.	Limit_woms_opps	Teams_reinstated

